<?xml version="1.0" encoding="UTF-8" standalone="no"?>
<!-- Copyright FUJITSU LIMITED 2018-->
<ess:essvcenter xmlns:ess="http://oscm.org/xsd" xmlns:xsi="http://www.w3.org/2001/XMLSchema-instance" xsi:schemaLocation="http://oscm.org/xsd ../../oscm-app-vmware\\resources\\XSD\\Loadbalancer_schema.xsd">
	<balancer class="org.oscm.app.vmware.business.balancer.EquipartitionHostBalancer" cpuWeight="0.5" memoryWeight="1" vmWeight="1"/>
	<host enabled="true" name="estvmwdev1.intern.est.fujitsu.com">
		<balancer class="org.oscm.app.vmware.business.balancer.EquipartitionStorageBalancer" storage="VMdev0,VMdev1"/>
    </host>
	<host enabled="true" name="estvmwdev2.intern.est.fujitsu.com">
		<balancer class="org.oscm.app.vmware.business.balancer.EquipartitionStorageBalancer" storage="VMdev0,VMdev1"/>
    </host>
    <storage enabled="true" limit="85%" name="VMdev0"/>
    <storage enabled="true" limit="85%" name="VMdev1"/>
</ess:essvcenter>

